published_at,title,description,url,sentiment,sentiment_score
2021-12-24T21:17:52+00:00,"A weak yen may be hurting Japanese households more than in the past, as the country's increasing reliance on more expensive raw material imports pushes up the cost of living.",Bank of Japan (BOJ) Governor Haruhiko Kuroda.,https://japantoday.com/category/quote-of-the-day/a-weak-yen-may-be-hurting-japanese-households-more-than-in-the-past-as-the-country%27s-increasing-reliance-on-more-expensive-raw-material-imports-pushes-up-the-cost-of-living.,negative,0.958471179008484
2021-12-24T18:26:54+00:00,"AUS vs ENG 3rd Test: Monty Panesar laments England’s over-reliance on Joe Root, says difference between “him and others is of 1000 runs”",AUS vs ENG 3rd Test: England team are staring down the barrel as Australia are enjoying a 2-0 lead going into the Boxing Day Test match. The Joe Root-led side will have to play out of their skins in order to claw their way back in the Test series in Melbourne. Former England cricketer Monty Panesar [&#8230;],https://www.insidesport.in/aus-vs-eng-3rd-test-monty-panesar-laments-englands-over-reliance-on-joe-root-says-difference-between-him-and-others-is-of-1000-runs/,neutral,0.7025849223136902
2021-12-24T17:30:12+00:00,“We need reformed mindsets to achieve Ghana Beyond Aid vision”—Dr. Yeboah,"Tema. Dec. 24, GNA — Dr. Eric Yeboah, Secretary to the Ghana Beyond Aid Committee, has stated that Ghanaians needed a reformed mindset to achieve the ‘Ghana Beyond Aid’ vision by President Nana Addo Dankwa Akufo-Addo. He said the vision was aimed at bringing prosperity and self-reliance to Ghanaians and the Africa Continent at large, [&#8230;]",https://www.ghanamma.com/2021/12/24/we-need-reformed-mindsets-to-achieve-ghana-beyond-aid-vision-dr-yeboah/,neutral,0.6705803275108337
2021-12-24T15:04:00+00:00,Exploring the use of the Python programming language for data engineering,"Python is one of the most popular programming languages worldwide. It often ranks high in surveys -- for instance, it claimed the first spot in the Popularity of Programming Language index and came second in the TIOBE index. The chief focus of Python was never web development. However, a few years ago, software engineers realized the potential Python held for this particular purpose and the language experienced a massive surge in popularity. But data engineers couldn’t do their job without Python, either. Since they have a heavy reliance on the programming language,it’s as important now...",https://betanews.com/2021/12/24/python-programming-for-data-engineering/,neutral,0.8465405702590942
2021-12-24T10:37:22+00:00,China Aircraft Leasing : POLL RESULTS OF THE EXTRAORDINARY GENERAL MEETING OF THE COMPANY HELD ON 24 DECEMBER 2021,"(marketscreener.com) Hong Kong Exchanges and Clearing Limited and The Stock Exchange of Hong Kong Limited take no responsibility for the contents of this announcement, make no representation as to its accuracy or completeness and expressly disclaim any liability whatsoever for any loss howsoever arising from or in reliance upon the whole or any part of...https://www.marketscreener.com/quote/stock/CHINA-AIRCRAFT-LEASING-GR-16878242/news/China-Aircraft-Leasing-POLL-RESULTS-OF-THE-EXTRAORDINARY-GENERAL-MEETING-OF-THE-COMPANY-HELD-ON-24-37411476/?utm_medium=RSS&utm_content=20211224",https://www.marketscreener.com/quote/stock/CHINA-AIRCRAFT-LEASING-GR-16878242/news/China-Aircraft-Leasing-POLL-RESULTS-OF-THE-EXTRAORDINARY-GENERAL-MEETING-OF-THE-COMPANY-HELD-ON-24-37411476/?utm_medium=RSS&utm_content=20211224,neutral,0.9118634462356568
2021-12-24T10:26:20+00:00,Danny Tyree | Does Baby New Year give you the creeps?,"Perhaps one reason I never get invited to New Year’s Eve parties is that I tend to overanalyze things. Take Baby New Year (a.k.a. “Bundle of White Male Joy”), for instance. Society’s reliance on this iconic tyke in editorial cartoons, greeting cards and advertising campaigns causes me to lose more sleep than the ball drop [&#8230;]",https://www.times-standard.com/2021/12/24/danny-tyree-does-baby-new-year-give-you-the-creeps/,neutral,0.5358757376670837
2021-12-24T10:17:03+00:00,China Aircraft Leasing : CHANGE OF NON-EXECUTIVE DIRECTOR,"(marketscreener.com) Hong Kong Exchanges and Clearing Limited and The Stock Exchange of Hong Kong Limited take no responsibility for the contents of this announcement, make no representation as to its accuracy or completeness and expressly disclaim any liability whatsoever for any loss howsoever arising from or in reliance upon the whole or any part of...https://www.marketscreener.com/quote/stock/CHINA-AIRCRAFT-LEASING-GR-16878242/news/China-Aircraft-Leasing-CHANGE-OF-NON-EXECUTIVE-DIRECTOR-37411433/?utm_medium=RSS&utm_content=20211224",https://www.marketscreener.com/quote/stock/CHINA-AIRCRAFT-LEASING-GR-16878242/news/China-Aircraft-Leasing-CHANGE-OF-NON-EXECUTIVE-DIRECTOR-37411433/?utm_medium=RSS&utm_content=20211224,neutral,0.8228488564491272
2021-12-24T10:07:04+00:00,Shanghai Fosun Pharmaceutical : FURTHER INFORMATION ON CONNECTED TRANSACTION REGARDING THE ENTERING INTO THE SHARE TRANSFER AGREEMENT (H SHARES),"(marketscreener.com) Hong Kong Exchanges and Clearing Limited and The Stock Exchange of Hong Kong Limited take no responsibility for the contents of this announcement, make no representation as to its accuracy or completeness and expressly disclaim any liability whatsoever for any loss howsoever arising from or in reliance upon the whole or...https://www.marketscreener.com/quote/stock/SHANGHAI-FOSUN-PHARMACEUT-6548924/news/Shanghai-Fosun-Pharmaceutical-FURTHER-INFORMATION-ON-CONNECTED-TRANSACTION-REGARDING-THE-ENTERING-37411407/?utm_medium=RSS&utm_content=20211224",https://www.marketscreener.com/quote/stock/SHANGHAI-FOSUN-PHARMACEUT-6548924/news/Shanghai-Fosun-Pharmaceutical-FURTHER-INFORMATION-ON-CONNECTED-TRANSACTION-REGARDING-THE-ENTERING-37411407/?utm_medium=RSS&utm_content=20211224,neutral,0.9313656091690063
2021-12-24T09:37:04+00:00,Agricultural Bank of China : LIST OF DIRECTORS AND THEIR ROLE AND FUNCTION2021-12-24,"(marketscreener.com) Hong Kong Exchanges and Clearing Limited and The Stock Exchange of Hong Kong Limited take no responsibility for the contents of this announcement, make no representation as to its accuracy or completeness and expressly disclaim any liability whatsoever for any loss howsoever arising from or in reliance upon the whole or...https://www.marketscreener.com/quote/stock/AGRICULTURAL-BANK-OF-CHIN-6354465/news/Agricultural-Bank-of-China-LIST-OF-DIRECTORS-AND-THEIR-ROLE-AND-FUNCTION2021-12-24-37411340/?utm_medium=RSS&utm_content=20211224",https://www.marketscreener.com/quote/stock/AGRICULTURAL-BANK-OF-CHIN-6354465/news/Agricultural-Bank-of-China-LIST-OF-DIRECTORS-AND-THEIR-ROLE-AND-FUNCTION2021-12-24-37411340/?utm_medium=RSS&utm_content=20211224,neutral,0.8977795839309692
2021-12-24T09:37:04+00:00,Agricultural Bank of China : ANNOUNCEMENT ON THE RESOLUTIONS OF THE BOARD OF DIRECTORS2021-12-24,"(marketscreener.com) Hong Kong Exchanges and Clearing Limited and The Stock Exchange of Hong Kong Limited take no responsibility for the contents of this announcement, make no representation as to its accuracy or completeness and expressly disclaim any liability whatsoever for any loss howsoever arising from or in reliance upon the whole or...https://www.marketscreener.com/quote/stock/AGRICULTURAL-BANK-OF-CHIN-6354465/news/Agricultural-Bank-of-China-ANNOUNCEMENT-ON-THE-RESOLUTIONS-OF-THE-BOARD-OF-DIRECTORS2021-12-24-37411341/?utm_medium=RSS&utm_content=20211224",https://www.marketscreener.com/quote/stock/AGRICULTURAL-BANK-OF-CHIN-6354465/news/Agricultural-Bank-of-China-ANNOUNCEMENT-ON-THE-RESOLUTIONS-OF-THE-BOARD-OF-DIRECTORS2021-12-24-37411341/?utm_medium=RSS&utm_content=20211224,neutral,0.909088373184204
2021-12-25T11:35:37+00:00,Reliance gets NCLT approval to withdraw scheme for demerging O2C business,"Last month, Reliance said it and Saudi Aramco will re-evaluate the proposed investment in O2C business due to the evolving nature of Reliance's business portfolio.",https://www.businesstoday.in/latest/corporate/story/reliance-gets-nclt-approval-to-withdraw-scheme-for-demerging-o2c-business-316832-2021-12-25?utm_source=rssfeed,neutral,0.8664591908454895
2021-12-25T10:34:49+00:00,Nordea Investment Management AB Grows Stock Position in Reliance Steel &#038; Aluminum Co. (NYSE:RS),Nordea Investment Management AB Grows Stock Position in Reliance Steel &#038; Aluminum Co. (NYSE:RS),https://www.americanbankingnews.com/2021/12/25/nordea-investment-management-ab-grows-stock-position-in-reliance-steel-aluminum-co-nysers.html,positive,0.8394119143486023
2021-12-25T10:34:45+00:00,Nordea Investment Management AB Grows Stock Position in Reliance Steel & Aluminum Co. (NYSE:RS),"Nordea Investment Management AB lifted its stake in shares of Reliance Steel & Aluminum Co. (NYSE:RS) by 99.0% in the 3rd quarter, according to its most recent Form 13F filing with the Securities and Exchange Commission (SEC). The fund owned 120,626 shares of the industrial products company&#8217;s stock after purchasing an additional 60,018 shares during [&#8230;]The post Nordea Investment Management AB Grows Stock Position in Reliance Steel & Aluminum Co. (NYSE:RS) appeared first on ETF Daily News.",https://etfdailynews.com/news/nordea-investment-management-ab-grows-stock-position-in-reliance-steel-aluminum-co-nysers/,positive,0.9402946829795836
2021-12-26T07:20:36+00:00,"Five of top-10 companies add over Rs 1 lakh cr in m-cap; Reliance, TCS lead chart","Where RIL, TCS, Hindustan Unilever Ltd. (HUL), Wipro, and Infosys were the lead gainers; State Bank of India (SBI), ICICI Bank, HDFC Bank, HDFC, and Bajaj Finance emerged as laggards.",https://www.businesstoday.in/markets/company-stock/story/five-of-top-10-companies-add-over-rs-1-lakh-cr-in-m-cap-reliance-tcs-lead-chart-316856-2021-12-26?utm_source=rssfeed,neutral,0.356919914484024
2021-12-27T13:22:44+00:00,Occidental Asset Management LLC Grows Position in Reliance Steel &#038; Aluminum Co. (NYSE:RS),Occidental Asset Management LLC Grows Position in Reliance Steel &#038; Aluminum Co. (NYSE:RS),https://www.americanbankingnews.com/2021/12/27/occidental-asset-management-llc-grows-position-in-reliance-steel-aluminum-co-nysers.html,positive,0.6054741144180298
2021-12-27T07:45:43+00:00,"Reliance Industries, State Bank of India, PVR among 5 stocks to buy for gains in 2022; check full list","Sensex and Nifty have rallied more than 21% so far in 2021, extending their bull run that started around April last year. Heading in 2022 the benchmark indices are expected to touch 20,800.",https://www.financialexpress.com/market/reliance-industries-state-bank-of-india-pvr-among-5-stocks-to-buy-for-gains-in-2022-check-full-list/2390794/,positive,0.9375912547111512
2021-12-27T02:48:43+00:00,"Reliance Industries, RBL Bank, HP Adhesives, SBI Cards among stocks in focus today","S&P BSE Sensex is currently placed at 57,124 points while the NSE Nifty 50 index is at 17,003. India VIX closed the previous week just above 16 levels.",https://www.financialexpress.com/market/reliance-industries-rbl-bank-hp-adhesives-sbi-cards-among-stocks-in-focus-today/2390434/,neutral,0.7255489826202393
2021-12-28T22:26:30+00:00,China pursues technology ‘self-reliance’ ,"To help make China a self-reliant “technology superpower,” the ruling Communist Party is pushing the world’s biggest e-commerce company to take on the tricky, expensive business of designing its own processor chips — a business unlike anything Alibaba Group has done before.",https://finance-commerce.com/2021/12/china-pursues-technology-self-reliance/,neutral,0.7291125059127808
2021-12-28T21:42:53+00:00,"China pursues tech 'self-reliance,' fueling global unease","To help make China a self-reliant “technology superpower,” the ruling Communist Party is pushing the world's biggest e-commerce company to take on the tricky, expensive business of designing…",https://japantoday.com/category/tech/china-pursues-tech-%27self-reliance-%27-fueling-global-unease,neutral,0.73338383436203
2021-12-28T19:35:50+00:00,"China pursues tech ‘self-reliance,’ fueling global unease","Beijing’s campaign is adding to tension with Washington and Europe, which see China as a strategic competitor and complain it steals technology. They limit access to tools needed to improve its industries.",https://nypost.com/2021/12/28/china-pursues-tech-self-reliance-fueling-global-unease/,negative,0.9384992122650146
2021-12-28T16:05:36+00:00,Mukesh Ambani talks of leadership transition at RIL; wants to accelerate the process,"Speaking at the Reliance Family Day, Asia's richest man said an organisational culture must be built at Reliance that outlasts its leaders.",https://www.businesstoday.in/latest/corporate/story/mukesh-ambani-talks-of-leadership-transition-at-ril-wants-to-accelerate-the-process-317120-2021-12-28?utm_source=rssfeed,positive,0.5272610187530518
2021-12-28T15:46:03+00:00,"Thinking about buying stock in Reliance Global, LiveOne, BridgeBio Pharma, Flotek Industries, or Nikola Corp?","(marketscreener.com) NEW YORK, Dec. 28, 2021 /PRNewswire/ -- InvestorsObserver&nbsp;issues critical PriceWatch Alerts for RELI, LVO, BBIO, FTK, and NKLA. To see how InvestorsObserver's proprietary scoring system rates these stocks, view the...https://www.marketscreener.com/quote/stock/FLOTEK-INDUSTRIES-INC-15373/news/Thinking-about-buying-stock-in-Reliance-Global-LiveOne-BridgeBio-Pharma-Flotek-Industries-or-Nik-37431371/?utm_medium=RSS&utm_content=20211228",https://www.marketscreener.com/quote/stock/FLOTEK-INDUSTRIES-INC-15373/news/Thinking-about-buying-stock-in-Reliance-Global-LiveOne-BridgeBio-Pharma-Flotek-Industries-or-Nik-37431371/?utm_medium=RSS&utm_content=20211228,neutral,0.9439511895179749
2021-12-28T15:42:07+00:00,"Mukesh Ambani talks of leadership transition at Reliance, wants to speed up process","Ambani sounded cautious over not letting the guard down saying while normalcy is returning, it still is clouded by uncertainty over the spread of the new variants.",https://www.financialexpress.com/industry/mukesh-ambani-talks-of-leadership-transition-at-reliance-wants-to-speed-up-process/2392433/,positive,0.4531773328781128
2021-12-28T14:40:43+00:00,Reliance Steel & Aluminum Co. (NYSE:RS) Shares Sold by LSV Asset Management,"LSV Asset Management reduced its stake in Reliance Steel & Aluminum Co. (NYSE:RS) by 1.4% during the 3rd quarter, according to the company in its most recent Form 13F filing with the Securities and Exchange Commission. The institutional investor owned 1,255,145 shares of the industrial products company&#8217;s stock after selling 17,850 shares during the period. [&#8230;]",https://www.americanbankingnews.com/2021/12/28/reliance-steel-aluminum-co-nysers-shares-sold-by-lsv-asset-management-2.html,negative,0.9632763266563416
2021-12-28T14:27:12+00:00,Shanghai Fosun Pharmaceutical : CONNECTED TRANSACTION &ndash; ENTERING INTO THE CAPITAL INCREASE AGREEMENT&#65288;H SHARES&#65289;,"(marketscreener.com) Hong Kong Exchanges and Clearing Limited and The Stock Exchange of Hong Kong Limited take no responsibility for the contents of this announcement, make no representation as to its accuracy or completeness and expressly disclaim any liability whatsoever for any loss howsoever arising from or in reliance upon the whole or...https://www.marketscreener.com/quote/stock/SHANGHAI-FOSUN-PHARMACEUT-6548924/news/Shanghai-Fosun-Pharmaceutical-CONNECTED-TRANSACTION-ndash-ENTERING-INTO-THE-CAPITAL-INCREASE-AGR-37430504/?utm_medium=RSS&utm_content=20211228",https://www.marketscreener.com/quote/stock/SHANGHAI-FOSUN-PHARMACEUT-6548924/news/Shanghai-Fosun-Pharmaceutical-CONNECTED-TRANSACTION-ndash-ENTERING-INTO-THE-CAPITAL-INCREASE-AGR-37430504/?utm_medium=RSS&utm_content=20211228,neutral,0.9386534094810486
2021-12-28T13:52:42+00:00,Reliance Steel &#038; Aluminum Co. (NYSE:RS) Shares Sold by LSV Asset Management,Reliance Steel &#038; Aluminum Co. (NYSE:RS) Shares Sold by LSV Asset Management,https://www.americanbankingnews.com/2021/12/28/reliance-steel-aluminum-co-nysers-shares-sold-by-lsv-asset-management.html,neutral,0.9304046630859376
2021-12-28T13:43:47+00:00,"China Pursues Tech 'Self-Reliance,' Fueling Global Unease","China Pursues Tech 'Self-Reliance,' Fueling Global Unease",https://www.naharnet.com/stories/en/286694-china-pursues-tech-self-reliance-fueling-global-unease,neutral,0.8965276479721069
2021-12-29T16:47:07+00:00,TL Natural Gas : APPOINTMENT OF INDEPENDENT NON-EXECUTIVE DIRECTOR AND CHAIRMAN OF AUDIT AND RISK MANAGEMENT COMMITTEE,"(marketscreener.com) Hong Kong Exchanges and Clearing Limited and The Stock Exchange of Hong Kong Limited take no responsibility for the contents of this announcement, make no representation as to its accuracy or completeness and expressly disclaim any liability whatsoever for any loss howsoever arising from or in reliance upon the whole or...https://www.marketscreener.com/quote/stock/TL-NATURAL-GAS-HOLDINGS-L-103501476/news/TL-Natural-Gas-APPOINTMENT-OF-INDEPENDENT-NON-EXECUTIVE-DIRECTOR-AND-CHAIRMAN-OF-AUDIT-AND-RISK-MA-37437210/?utm_medium=RSS&utm_content=20211229",https://www.marketscreener.com/quote/stock/TL-NATURAL-GAS-HOLDINGS-L-103501476/news/TL-Natural-Gas-APPOINTMENT-OF-INDEPENDENT-NON-EXECUTIVE-DIRECTOR-AND-CHAIRMAN-OF-AUDIT-AND-RISK-MA-37437210/?utm_medium=RSS&utm_content=20211229,neutral,0.9236401915550232
2021-12-29T16:47:07+00:00,TL Natural Gas : APPOINTMENT OF AUDITORS,"(marketscreener.com) Hong Kong Exchanges and Clearing Limited and The Stock Exchange of Hong Kong Limited take no responsibility for the contents of this announcement, make no representation as to its accuracy or completeness and expressly disclaim any liability whatsoever for any loss howsoever arising from or in reliance upon the whole or any part of...https://www.marketscreener.com/quote/stock/TL-NATURAL-GAS-HOLDINGS-L-103501476/news/TL-Natural-Gas-APPOINTMENT-OF-AUDITORS-37437206/?utm_medium=RSS&utm_content=20211229",https://www.marketscreener.com/quote/stock/TL-NATURAL-GAS-HOLDINGS-L-103501476/news/TL-Natural-Gas-APPOINTMENT-OF-AUDITORS-37437206/?utm_medium=RSS&utm_content=20211229,neutral,0.9039261341094972
2021-12-29T15:46:05+00:00,"Thinking about buying stock in Flotek Industries, NRX Pharmaceuticals, Medallion Financial, Reliance Global, or Codex DNA?","(marketscreener.com) NEW YORK, Dec. 29, 2021 /PRNewswire/ -- InvestorsObserver&nbsp;issues critical PriceWatch Alerts for FTK, NRXP, MFIN, RELI, and DNAY. To see how InvestorsObserver's proprietary scoring system rates these stocks, view the...https://www.marketscreener.com/quote/stock/FLOTEK-INDUSTRIES-INC-15373/news/Thinking-about-buying-stock-in-Flotek-Industries-NRX-Pharmaceuticals-Medallion-Financial-Reliance-37436966/?utm_medium=RSS&utm_content=20211229",https://www.marketscreener.com/quote/stock/FLOTEK-INDUSTRIES-INC-15373/news/Thinking-about-buying-stock-in-Flotek-Industries-NRX-Pharmaceuticals-Medallion-Financial-Reliance-37436966/?utm_medium=RSS&utm_content=20211229,neutral,0.9421817660331726
2021-12-29T14:37:23+00:00,Xinhua Winshare Publishing and Media : Continuing Connected Transactions,"(marketscreener.com) Hong Kong Exchanges and Clearing Limited and The Stock Exchange of Hong Kong Limited take no responsibility for the contents of this announcement, make no representation as to its accuracy or completeness and expressly disclaim any liability whatsoever for any loss howsoever arising from or in reliance upon the whole or...https://www.marketscreener.com/quote/stock/XINHUA-WINSHARE-PUBLISHIN-6170670/news/Xinhua-Winshare-Publishing-and-Media-Continuing-Connected-Transactions-37436661/?utm_medium=RSS&utm_content=20211229",https://www.marketscreener.com/quote/stock/XINHUA-WINSHARE-PUBLISHIN-6170670/news/Xinhua-Winshare-Publishing-and-Media-Continuing-Connected-Transactions-37436661/?utm_medium=RSS&utm_content=20211229,neutral,0.9116359353065492
2021-12-29T14:21:57+00:00,MoD notifies positive indigenisation list of sub-systems/assemblies/ sub-assemblies/components to achieve self-reliance in defence & minimise imports by DPSUs,"New Delhi : A positive indigenisation list of sub-systems/assemblies/sub-assemblies/components has been notified by Department of Defence Production, Ministry of Defence, as part of the efforts to achieve self-reliance in defence manufacturing and minimise imports by Defence Public Sector Undertakings (DPSUs). The list contains 2,500 imported items which have already been indigenised and 351 imported items [&#8230;]",https://orissadiary.com/mod-notifies-positive-indigenisation-list-of-sub-systems-assemblies-sub-assemblies-components-to-achieve-self-reliance-in-defence-minimise-imports-by-dpsus/,neutral,0.9169979095458984
2021-12-29T12:41:11+00:00,"How infra creation, MSME financing and digitisation can help make India a manufacturing superpower","The COVID-19 pandemic has shown that achieving self-reliance is not a matter of choice but a necessity. With the global supply chain being in a flux, there is an opportunity for India.",https://www.businesstoday.in/opinion/columns/story/how-infra-creation-msme-financing-and-digitisation-can-help-make-india-a-manufacturing-superpower-317236-2021-12-29?utm_source=rssfeed,positive,0.5800700187683105
2021-12-29T10:33:29+00:00,Người giàu nhất châu Á tăng tốc 'truyền ngôi',Mukesk Ambani thúc giục chuyển giao quyền lực tại Reliance Industries và muốn thấy đế chế này lên tầm cao mới dưới sự kiểm soát của 3 người con.,https://vnexpress.net/nguoi-giau-nhat-chau-a-tang-toc-truyen-ngoi-4409782.html,neutral,0.8916394710540771
2021-12-29T09:22:07+00:00,"India stops import of 2,851 components used in defence platforms","The defence ministry on Wednesday notified a positive indigenisation list of sub-systems, assemblies, sub-assemblies and components to achieve self-reliance in defence",https://www.business-standard.com/article/current-affairs/india-stops-import-of-2-851-components-used-in-defence-platforms-121122900626_1.html,neutral,0.488584041595459
2021-12-29T08:07:03+00:00,MoD notifies positive indigenisation list of sub-systems/assemblies/ sub-assemblies/components to achieve self-reliance in defence & minimise imports by DPSUs,(marketscreener.com) Ministry of Defence MoD notifies positive indigenisation list of sub-systems/assemblies/ sub-assemblies/components to achieve self-reliance in defence &amp; minimise imports by DPSUs Posted On: 29 DEC 2021 1:11PM by PIB Delhi A positive indigenisation list of...https://www.marketscreener.com/news/latest/MoD-notifies-positive-indigenisation-list-of-sub-systems-assemblies-sub-assemblies-components-to-ac--37434126/?utm_medium=RSS&utm_content=20211229,https://www.marketscreener.com/news/latest/MoD-notifies-positive-indigenisation-list-of-sub-systems-assemblies-sub-assemblies-components-to-ac--37434126/?utm_medium=RSS&utm_content=20211229,neutral,0.9118579626083374
2021-12-29T06:55:16+00:00,Asia’s Richest Man Mukesh Ambani Wants to Speed Up Reliance’s Leadership Shift,Asia’s Richest Man Mukesh Ambani Wants to Speed Up Reliance’s Leadership Shift,https://www.bloombergquint.com/business/asia-s-richest-man-wants-to-speed-up-reliance-s-leadership-shift,neutral,0.7053601145744324
2021-12-30T19:33:08+00:00,"Germany To Shut Down All Remaining Nuclear Plants, Forcing Reliance On Fossil Fuels",'The nuclear phase-out is final',https://dailycaller.com/2021/12/30/germany-nuclear-power-renewable-energy-climate-change-fossil-fuels/,negative,0.9221287965774536
2021-12-30T15:45:54+00:00,"Lancashire MP slams mental health trusts for ""pulling bobbies away from the beat""",West Lancashire MP Rosie Cooper has blasted NHS mental health trusts for their reliance on the police.,https://www.lancasterguardian.co.uk/health/lancashire-mp-slams-mental-health-trusts-for-pulling-bobbies-away-from-the-beat-3510566,negative,0.894989013671875
2021-12-30T14:44:20+00:00,"Sterling and Wilson Renewable Energy board approves allotment of 2.93 crore shares worth Rs 1,099 crore to Reliance New Energy Solar","Post this transaction, Reliance New Energy Solar Ltd (RNESL), part of Reliance Industries, will hold 15.46 per cent paid-up equity share capital of SWRE.",https://www.financialexpress.com/market/sterling-and-wilson-renewable-energy-board-approves-allotment-of-2-93-crore-shares-worth-rs-1099-crore-to-reliance-new-energy-solar/2394575/,neutral,0.9125179648399352
2021-12-30T13:31:06+00:00,"Thinking about buying stock in Reliance Global, Naked Brand, Kiora Pharmaceuticals, Aridis Pharmaceuticals, or Biondvax Pharmaceuticals?","(marketscreener.com) NEW YORK, Dec. 30, 2021 /PRNewswire/ -- InvestorsObserver&nbsp;issues critical PriceWatch Alerts for RELI, NAKD, KPRX, ARDS, and BVXV. To see how InvestorsObserver's proprietary scoring system rates these stocks, view the...https://www.marketscreener.com/quote/stock/RELIANCE-GLOBAL-GROUP-IN-55018361/news/Thinking-about-buying-stock-in-Reliance-Global-Naked-Brand-Kiora-Pharmaceuticals-Aridis-Pharmaceu-37441157/?utm_medium=RSS&utm_content=20211230",https://www.marketscreener.com/quote/stock/RELIANCE-GLOBAL-GROUP-IN-55018361/news/Thinking-about-buying-stock-in-Reliance-Global-Naked-Brand-Kiora-Pharmaceuticals-Aridis-Pharmaceu-37441157/?utm_medium=RSS&utm_content=20211230,neutral,0.9423173666000366
