published_at,title,description,url,sentiment,sentiment_score
2022-01-24T14:24:11+00:00,Xinhua Winshare Publishing and Media : Poll Results Of The Extraordinary General Meeting Held On 24 January 2022,"(marketscreener.com) Hong Kong Exchanges and Clearing Limited and The Stock Exchange of Hong Kong Limited take no responsibility for the contents of this announcement, make no representation as to its accuracy or completeness and expressly disclaim any liability whatsoever for any loss howsoever arising from or in reliance upon the whole or...https://www.marketscreener.com/quote/stock/XINHUA-WINSHARE-PUBLISHIN-6170670/news/Xinhua-Winshare-Publishing-and-Media-Poll-Results-Of-The-Extraordinary-General-Meeting-Held-On-24-37625733/?utm_medium=RSS&utm_content=20220124",https://www.marketscreener.com/quote/stock/XINHUA-WINSHARE-PUBLISHIN-6170670/news/Xinhua-Winshare-Publishing-and-Media-Poll-Results-Of-The-Extraordinary-General-Meeting-Held-On-24-37625733/?utm_medium=RSS&utm_content=20220124,neutral,0.915813446044922
2022-01-24T11:24:44+00:00,California Public Employees Retirement System Reduces Stock Position in Reliance Steel &#038; Aluminum Co. (NYSE:RS),California Public Employees Retirement System Reduces Stock Position in Reliance Steel &#038; Aluminum Co. (NYSE:RS),https://www.americanbankingnews.com/2022/01/24/california-public-employees-retirement-system-reduces-stock-position-in-reliance-steel-aluminum-co-nysers.html,negative,0.9340046644210817
2022-01-25T23:35:18+00:00,Here’s how Texans can get free at-home COVID-19 tests and N95 masks from the federal government,"This month, the Texas’ COVID-19 positivity rate — the percentage of tests with positive results — soared to its highest peak yet amid the onset of the highly transmissible omicron variant. With the most recent surge in cases came a renewed reliance on testing. During the holiday season, Texans scrambled to secure at-home tests andThe post Here’s how Texans can get free at-home COVID-19 tests and N95 masks from the federal government appeared first on KVIA.",https://kvia.com/news/texas/2022/01/25/heres-how-texans-can-get-free-at-home-covid-19-tests-and-n95-masks-from-the-federal-government/,positive,0.5975342392921448
2022-01-25T21:05:46+00:00,Couldn’t get a Jio SIM for your Samsung Z2? Here’s how you can!,(Note: You can skip to the last part if you are here just to know how to get the Jio sim as mentioned in the title) The newborn Indian telecom carrier service provider Reliance Jio has become the talk of the town in the country&#8217;s urban areas. Reliance Jio is currently testing out its service in [&#8230;]The post Couldn&#8217;t get a Jio SIM for your Samsung Z2? Here&#8217;s how you can! appeared first on ReadWrite.,https://readwrite.com/couldnt-get-a-jio-sim-for-your-samsung-z2-heres-how-you-can/,neutral,0.8956313729286194
2022-01-25T21:05:46+00:00,Video: Samsung Z2 Unboxing,"&#160; The Samsung Z2 was launched recently in India for a price of Rs. 4,590. The Z2 is the first 4G enabled smartphone from Samsung and the company are promoting the handset with free 90 days of unlimited 4G internet and voice call service courtesy of Reliance Jio. The smartphone has received a lot of [&#8230;]The post Video: Samsung Z2 Unboxing appeared first on ReadWrite.",https://readwrite.com/samsung-z2-unboxing-video-tizen-experts/,neutral,0.7540744543075562
2022-01-25T20:14:55+00:00,$1.2 billion Royal Beach development will bring thousands of new homes to Colwood,"VICTORIA — A pair of Vancouver-based developers say they will inject $1.2 billion into the massive Royal Beach residential and commercial development in Colwood, creating about 10,500 jobs over the next 15 years. Reliance Properties, known for its Janion and Northern Junk developments in Downtown Victoria, is partnering with Seacliff Properties to build out the [&#8230;]",https://vancouversun.com/business/real-estate/1-2-billion-royal-beach-development-will-bring-thousands-of-new-homes-to-colwood,positive,0.6443462371826172
2022-01-25T16:24:47+00:00,Reliance Steel &#038; Aluminum Co. (NYSE:RS) Shares Sold by Advisory Research Inc.,Reliance Steel &#038; Aluminum Co. (NYSE:RS) Shares Sold by Advisory Research Inc.,https://www.americanbankingnews.com/2022/01/25/reliance-steel-aluminum-co-nysers-shares-sold-by-advisory-research-inc.html,neutral,0.9434546232223512
2022-01-25T15:25:31+00:00,"Reliance Jio To Launch Budget JioPhone 5G Later This Year, Leaks Reveal","Leaks indicate that the device could sport Qualcomm’s Snapdragon 480 5G chipset, which is considerably more powerful than the Snapdragon 215 spotted on the JioPhone Next.",https://www.indiatimes.com/technology/news/reliance-jiophone-5g-features-price-560347.html,neutral,0.7286427021026611
2022-01-25T15:21:02+00:00,"ETQ Announces General Availability of a New Advanced Lab Investigation Application; New Version of Reliance NXG to More Easily Identify, Resolve and Analyze Quality Issues","(marketscreener.com) Winter 2022 Release of QMS Focuses on Usability, Mobility and Actionable Insightshttps://www.marketscreener.com/news/latest/ETQ-Announces-General-Availability-of-a-New-Advanced-Lab-Investigation-Application-New-Version-of-R--37637874/?utm_medium=RSS&utm_content=20220125",https://www.marketscreener.com/news/latest/ETQ-Announces-General-Availability-of-a-New-Advanced-Lab-Investigation-Application-New-Version-of-R--37637874/?utm_medium=RSS&utm_content=20220125,neutral,0.7770665884017944
2022-01-25T14:32:07+00:00,Future Retail in SC to avert defaulter tag; independent directors reject Amazon brought offer,"In the petition, Future cited its dispute with partner Amazon, which has stalled its Rs 24,713 crore retail asset sale to Reliance.",https://www.financialexpress.com/industry/future-retail-in-sc-to-avert-defaulter-tag-independent-directors-reject-amazon-brought-offer/2415831/,negative,0.9544706344604492
2022-01-25T14:23:04+00:00,Iran's cost-of-living squeeze belies push for economic self-reliance,"(marketscreener.com) Every day Mohammad Hosseini feelssqueezed by Iran's soaring prices, his experience of hardship atodds with a rosy official target of 8% economic growth even withU.S. sanctions still in place. The retired teacher's plight is found across the IslamicRepublic, where worsening economic misery is palpable afteryears of harsh U.S....https://www.marketscreener.com/news/latest/Iran-s-cost-of-living-squeeze-belies-push-for-economic-self-reliance--37637217/?utm_medium=RSS&utm_content=20220125",https://www.marketscreener.com/news/latest/Iran-s-cost-of-living-squeeze-belies-push-for-economic-self-reliance--37637217/?utm_medium=RSS&utm_content=20220125,neutral,0.5122007131576538
2022-01-25T13:07:26+00:00,Lai Sun Garment International : GRANT OF SHARE OPTIONS,"(marketscreener.com) Hong Kong Exchanges and Clearing Limited and The Stock Exchange of Hong Kong Limited take no responsibility for the contents of this announcement, make no representation as to its accuracy or completeness and expressly disclaim any liability whatsoever for any loss howsoever arising from or in reliance upon the whole or any part of...https://www.marketscreener.com/quote/stock/LAI-SUN-GARMENT-INTERNAT-6165714/news/Lai-Sun-Garment-International-GRANT-OF-SHARE-OPTIONS-37634561/?utm_medium=RSS&utm_content=20220125",https://www.marketscreener.com/quote/stock/LAI-SUN-GARMENT-INTERNAT-6165714/news/Lai-Sun-Garment-International-GRANT-OF-SHARE-OPTIONS-37634561/?utm_medium=RSS&utm_content=20220125,neutral,0.9142894744873048
2022-01-26T18:16:04+00:00,Coast Guard intercepts 191 Haitians near Bahamas,"Coast Guard Kathleen Moore’s crew located a green and blue sail freighter with 191 people aboard during a routine patrol about 40 miles southwest of Great Inagua, Bahamas, Jan 25, 2022. The crew provided life jackets and brought the Haitians aboard the Coast Guard Cutters Reliance and Kathleen Moore due to safety of life at sea concerns. (U.S. Coast Guard photo)",https://www.dvidshub.net/image/7023283/coast-guard-intercepts-191-haitians-near-bahamas,neutral,0.7665648460388184
2022-01-26T15:20:54+00:00,"Baby whale genetic testing may help save species, study says","Greater reliance on genetic testing of baby whales and their mothers can provide more accurate information about a rare species and increase the chances of saving them from extinction, according to the authors of a new scientific study.",https://phys.org/news/2022-01-baby-whale-genetic-species.html,positive,0.8229299783706665
2022-01-26T15:07:16+00:00,EU needs to tackle Russia energy dependence,"(marketscreener.com) Europe needs to cut its reliance on Russian energy imports, the EU's high representative for foreign affairs Josep Borrell said in Brussels on 25 January. Speaking against the background of the continuing crisis over Ukraine, Borrell said the EU &quot;must reduce the outsized role that energy considerations play in EU-Russia...https://www.marketscreener.com/news/latest/EU-needs-to-tackle-Russia-energy-dependence--37649299/?utm_medium=RSS&utm_content=20220126",https://www.marketscreener.com/news/latest/EU-needs-to-tackle-Russia-energy-dependence--37649299/?utm_medium=RSS&utm_content=20220126,neutral,0.6399167776107788
2022-01-26T14:19:38+00:00,"Baby whale genetic testing may help save species, study says","Greater reliance on genetic testing of baby whales and their mothers can provide more accurate information about a rare species and increase the chances of saving them from extinction, according to the authors of a new scientific study. The scientists, led by researchers at the New England Aquarium in Boston, studied critically endangered North Atlantic [&#8230;]",https://www.pressherald.com/2022/01/26/baby-whale-genetic-testing-may-help-save-species-study-says/,positive,0.7877678871154785
2022-01-26T13:26:23+00:00,First Tractor : ANNOUNCEMENT ON ESTIMATED INCREASE IN ANNUAL RESULTS FOR THE YEAR 2021 (in PDF),"(marketscreener.com) Hong Kong Exchanges and Clearing Limited and The Stock Exchange of Hong Kong Limited take no responsibility for the contents of this announcement, make no representation as to its accuracy or completeness and expressly disclaim any liability whatsoever for any loss howsoever arising from or in reliance upon the whole or...https://www.marketscreener.com/quote/stock/FIRST-TRACTOR-COMPANY-LIM-6158828/news/First-Tractor-ANNOUNCEMENT-ON-ESTIMATED-INCREASE-IN-ANNUAL-RESULTS-FOR-THE-YEAR-2021-in-PDF-37646338/?utm_medium=RSS&utm_content=20220126",https://www.marketscreener.com/quote/stock/FIRST-TRACTOR-COMPANY-LIM-6158828/news/First-Tractor-ANNOUNCEMENT-ON-ESTIMATED-INCREASE-IN-ANNUAL-RESULTS-FOR-THE-YEAR-2021-in-PDF-37646338/?utm_medium=RSS&utm_content=20220126,neutral,0.886766791343689
2022-01-26T13:16:13+00:00,Lakeland Bancorp : Investor Presentation - 4th Quarter 2021,(marketscreener.com) FOURTH QUARTER 2021 INVESTORS PRESENTATION Forward-Looking Statements The information disclosed in this document includes various forward-looking statements that are made in reliance upon the safe harbor provisions of...https://www.marketscreener.com/quote/stock/LAKELAND-BANCORP-INC-9850/news/Lakeland-Bancorp-Investor-Presentation-4th-Quarter-2021-37646243/?utm_medium=RSS&utm_content=20220126,https://www.marketscreener.com/quote/stock/LAKELAND-BANCORP-INC-9850/news/Lakeland-Bancorp-Investor-Presentation-4th-Quarter-2021-37646243/?utm_medium=RSS&utm_content=20220126,neutral,0.9353941679000854
2022-01-26T12:57:29+00:00,"Baby whale genetic testing may help save species, study says",Authors of a new scientific study say greater reliance on genetic testing of baby whales and their mothers may help save a rare species from extinction,https://www.independent.co.uk/news/portland-maine-north-atlantic-boston-science-b2001055.html,positive,0.6648451685905457
2022-01-26T12:00:03+00:00,How Capable Is The Iraqi Air Force?,'The Iraqi Air Force’s F-16 fleet has been able to maintain a steady if still low tempo of deliberate pre-planned strikes while gradually reducing reliance on US contractor support.',https://www.forbes.com/sites/pauliddon/2022/01/26/how-capable-is-the-iraqi-air-force/,positive,0.9421511888504028
2022-01-26T09:26:16+00:00,Cyprus competitiveness hindered by weaknesses in several sectors,"Cyprus is suffering from a low level of judicial efficiency, excessive reliance on a limited number of countries for trade relations, as well as high costs for cross-border transactions, according to a report released on Tuesday by the Cyprus Economy and Competitiveness Council. “The Covid-19 pandemic upset a course of...",https://cyprus-mail.com/2022/01/26/cyprus-competitiveness-hindered-by-weaknesses-in-several-sectors/,negative,0.9640519618988036
2022-01-26T09:16:10+00:00,Agricultural Bank of China : ANNOUNCEMENT ON THE RESOLUTIONS OF THE BOARD OF DIRECTORS2022-01-26,"(marketscreener.com) Hong Kong Exchanges and Clearing Limited and The Stock Exchange of Hong Kong Limited take no responsibility for the contents of this announcement, make no representation as to its accuracy or completeness and expressly disclaim any liability whatsoever for any loss howsoever arising from or in reliance upon the whole or...https://www.marketscreener.com/quote/stock/AGRICULTURAL-BANK-OF-CHIN-6354465/news/Agricultural-Bank-of-China-ANNOUNCEMENT-ON-THE-RESOLUTIONS-OF-THE-BOARD-OF-DIRECTORS2022-01-26-37643676/?utm_medium=RSS&utm_content=20220126",https://www.marketscreener.com/quote/stock/AGRICULTURAL-BANK-OF-CHIN-6354465/news/Agricultural-Bank-of-China-ANNOUNCEMENT-ON-THE-RESOLUTIONS-OF-THE-BOARD-OF-DIRECTORS2022-01-26-37643676/?utm_medium=RSS&utm_content=20220126,neutral,0.9166974425315856
2022-01-27T16:38:41+00:00,"First Reliance Bancshares (OTCBB:FSRL) Posts Quarterly Earnings Results, Meets Expectations","First Reliance Bancshares (OTCBB:FSRL) Posts Quarterly Earnings Results, Meets Expectations",https://www.americanbankingnews.com/2022/01/27/first-reliance-bancshares-otcbbfsrl-posts-quarterly-earnings-results-meets-expectations.html,positive,0.8824909329414368
2022-01-27T16:36:17+00:00,India’s Reliance in talks to raise $1.6 bln for media JV as Viacom seeks lower stake -sources,"NEW DELHI &#8212; India&#8217;s Reliance Industries is in talks with investors to raise up to $1.6 billion for its broadcasting business as its partner, ViacomCBS , looks to pare its interest in the joint venture, two sources told Reuters on Thursday. Reliance is holding talks with an investment company set up by James Murdoch, son [&#8230;]",https://nationalpost.com/pmn/entertainment-pmn/indias-reliance-in-talks-to-raise-1-6-bln-for-media-jv-as-viacom-seeks-lower-stake-sources,positive,0.5405707955360413
2022-01-27T15:36:19+00:00,Public Accounts Committee 'not satisfied' with reliance on hotels for direct provision,The PAC has made a number of recommendations on the system.,https://www.thejournal.ie/direct-provision-hotels-accommodation-5666181-Jan2022/,neutral,0.8957655429840088
2022-01-27T14:09:21+00:00,"Emperor International : US$250,000,000 4.5% Notes Due September 2023 - Purchase and Cancellation of Part of the Notes","(marketscreener.com) Hong Kong Exchanges and Clearing Limited and The Stock Exchange of Hong Kong Limited take no responsibility for the contents of this announcement, make no representation as to its accuracy or completeness and expressly disclaim any liability whatsoever for any loss howsoever arising from or in reliance upon the whole or...https://www.marketscreener.com/quote/stock/EMPEROR-INTERNATIONAL-HOL-1412753/news/Emperor-International-US-250-000-000-4-5-Notes-Due-September-2023-Purchase-and-Cancellation-of-37660096/?utm_medium=RSS&utm_content=20220127",https://www.marketscreener.com/quote/stock/EMPEROR-INTERNATIONAL-HOL-1412753/news/Emperor-International-US-250-000-000-4-5-Notes-Due-September-2023-Purchase-and-Cancellation-of-37660096/?utm_medium=RSS&utm_content=20220127,neutral,0.8589825630187988
2022-01-27T11:49:16+00:00,Silk Road Logistics : Announcements and Notices - CONNECTED TRANSACTION - LOAN AGREEMENT,"(marketscreener.com) Hong Kong Exchanges and Clearing Limited and The Stock Exchange of Hong Kong Limited take no responsibility for the contents of this announcement, make no representation as to its accuracy or completeness and expressly disclaim any liability whatsoever for any loss howsoever arising from or in reliance upon the whole or...https://www.marketscreener.com/quote/stock/SILK-ROAD-LOGISTICS-HOLDI-6170780/news/Silk-Road-Logistics-Announcements-and-Notices-CONNECTED-TRANSACTION-LOAN-AGREEMENT-37657911/?utm_medium=RSS&utm_content=20220127",https://www.marketscreener.com/quote/stock/SILK-ROAD-LOGISTICS-HOLDI-6170780/news/Silk-Road-Logistics-Announcements-and-Notices-CONNECTED-TRANSACTION-LOAN-AGREEMENT-37657911/?utm_medium=RSS&utm_content=20220127,neutral,0.8991174697875977
2022-01-27T09:09:15+00:00,Greatwalle : Announcements and Notices -,"(marketscreener.com) Hong Kong Exchanges and Clearing Limited and The Stock Exchange of Hong Kong Limited take no responsibility for the contents of this announcement, make no representation as to its accuracy or completeness and expressly disclaim any liability whatsoever for any loss howsoever arising from or in reliance upon the whole or...https://www.marketscreener.com/quote/stock/GREATWALLE-INC-23746648/news/Greatwalle-Announcements-and-Notices-37656251/?utm_medium=RSS&utm_content=20220127",https://www.marketscreener.com/quote/stock/GREATWALLE-INC-23746648/news/Greatwalle-Announcements-and-Notices-37656251/?utm_medium=RSS&utm_content=20220127,neutral,0.8895441293716431
2022-01-27T07:34:46+00:00,Reliance Steel &#038; Aluminum Co. (NYSE:RS) Expected to Post Quarterly Sales of $3.87 Billion,Reliance Steel &#038; Aluminum Co. (NYSE:RS) Expected to Post Quarterly Sales of $3.87 Billion,https://www.americanbankingnews.com/2022/01/27/reliance-steel-aluminum-co-nysers-expected-to-post-quarterly-sales-of-3-87-billion-4.html,neutral,0.6771137714385986
2022-01-27T07:34:41+00:00,Reliance Steel &#038; Aluminum Co. (NYSE:RS) Expected to Post Quarterly Sales of $3.87 Billion,Reliance Steel &#038; Aluminum Co. (NYSE:RS) Expected to Post Quarterly Sales of $3.87 Billion,https://www.americanbankingnews.com/2022/01/27/reliance-steel-aluminum-co-nysers-expected-to-post-quarterly-sales-of-3-87-billion-3.html,neutral,0.6771137714385986
2022-01-27T07:08:06+00:00,Reliance Steel &#038; Aluminum Co. (NYSE:RS) Expected to Post Quarterly Sales of $3.87 Billion,Reliance Steel &#038; Aluminum Co. (NYSE:RS) Expected to Post Quarterly Sales of $3.87 Billion,https://www.americanbankingnews.com/2022/01/27/reliance-steel-aluminum-co-nysers-expected-to-post-quarterly-sales-of-3-87-billion.html,neutral,0.6771137714385986
2022-01-27T07:08:06+00:00,Reliance Steel &#038; Aluminum Co. (NYSE:RS) Expected to Post Quarterly Sales of $3.87 Billion,Reliance Steel &#038; Aluminum Co. (NYSE:RS) Expected to Post Quarterly Sales of $3.87 Billion,https://www.americanbankingnews.com/2022/01/27/reliance-steel-aluminum-co-nysers-expected-to-post-quarterly-sales-of-3-87-billion-2.html,neutral,0.6771137714385986
2022-01-28T20:00:02+00:00,"Treasury Considers Alternatives to ID.me Verification Citing Privacy Concerns, Bloomberg News Reports","(marketscreener.com) -- The Treasury Department and Internal Revenue Service are looking into their reliance on ID.me facial recognition software to access the IRS website over privacy concerns, Bloomberg News reported. -- The IRS had said that those who wanted to access an online account on IRS.gov would have to verify their identity with a ""selfie,"" ...https://www.marketscreener.com/news/latest/Treasury-Considers-Alternatives-to-ID-me-Verification-Citing-Privacy-Concerns-Bloomberg-News-Report--37676636/?utm_medium=RSS&utm_content=20220128",https://www.marketscreener.com/news/latest/Treasury-Considers-Alternatives-to-ID-me-Verification-Citing-Privacy-Concerns-Bloomberg-News-Report--37676636/?utm_medium=RSS&utm_content=20220128,neutral,0.6490523219108582
2022-01-28T16:08:51+00:00,Reliance Steel &#038; Aluminum Co. (NYSE:RS) Stock Holdings Lifted by Lodge Hill Capital LLC,Reliance Steel &#038; Aluminum Co. (NYSE:RS) Stock Holdings Lifted by Lodge Hill Capital LLC,https://www.americanbankingnews.com/2022/01/28/reliance-steel-aluminum-co-nysers-stock-holdings-lifted-by-lodge-hill-capital-llc.html,neutral,0.5550759434700012
2022-01-28T15:08:48+00:00,Reliance Steel & Aluminum (NYSE:RS) Upgraded to Market Perform by Wolfe Research,"Reliance Steel & Aluminum (NYSE:RS) was upgraded by Wolfe Research from an &#8220;underperform&#8221; rating to a &#8220;market perform&#8221; rating in a research report issued on Friday, Price Targets.com reports. The firm currently has a $159.00 price target on the industrial products company&#8217;s stock, up from their prior price target of $156.00. Wolfe Research&#8217;s price objective [&#8230;]",https://www.americanbankingnews.com/2022/01/28/reliance-steel-aluminum-nysers-upgraded-to-market-perform-by-wolfe-research.html,positive,0.9480721950531006
2022-01-28T15:03:09+00:00,Shimao : Discloseable Transaction - Disposal of Hotel Property,"(marketscreener.com) Hong Kong Exchanges and Clearing Limited and The Stock Exchange of Hong Kong Limited take no responsibility for the contents of this announcement, make no representation as to its accuracy or completeness and expressly disclaim any liability whatsoever for any loss howsoever arising from or in reliance upon the whole or...https://www.marketscreener.com/quote/stock/SHIMAO-GROUP-HOLDINGS-LIM-6170672/news/Shimao-Discloseable-Transaction-Disposal-of-Hotel-Property-37674732/?utm_medium=RSS&utm_content=20220128",https://www.marketscreener.com/quote/stock/SHIMAO-GROUP-HOLDINGS-LIM-6170672/news/Shimao-Discloseable-Transaction-Disposal-of-Hotel-Property-37674732/?utm_medium=RSS&utm_content=20220128,neutral,0.9146087169647216
2022-01-28T14:34:44+00:00,Reliance Steel &#038; Aluminum Co. (NYSE:RS) Shares Sold by Oppenheimer Asset Management Inc.,Reliance Steel &#038; Aluminum Co. (NYSE:RS) Shares Sold by Oppenheimer Asset Management Inc.,https://www.americanbankingnews.com/2022/01/28/reliance-steel-aluminum-co-nysers-shares-sold-by-oppenheimer-asset-management-inc.html,neutral,0.9426783919334412
2022-01-28T14:33:09+00:00,VOLUNTARY ANNOUNCEMENT: ACQUISITIONS OF EQUITY INTERESTS IN FIVE TARGET COMPANIES,"(marketscreener.com) Hong Kong Exchanges and Clearing Limited and The Stock Exchange of Hong Kong Limited take no responsibility for the contents of this announcement, make no representation as to its accuracy or completeness and expressly disclaim any liability whatsoever for any loss howsoever arising from or in reliance upon the whole or...https://www.marketscreener.com/quote/stock/CHINA-CONCH-VENTURE-HOLDI-15252881/news/VOLUNTARY-ANNOUNCEMENT-ACQUISITIONS-OF-EQUITY-INTERESTS-IN-FIVE-TARGET-COMPANIES-37674416/?utm_medium=RSS&utm_content=20220128",https://www.marketscreener.com/quote/stock/CHINA-CONCH-VENTURE-HOLDI-15252881/news/VOLUNTARY-ANNOUNCEMENT-ACQUISITIONS-OF-EQUITY-INTERESTS-IN-FIVE-TARGET-COMPANIES-37674416/?utm_medium=RSS&utm_content=20220128,neutral,0.919536590576172
2022-01-28T12:22:42+00:00,Reliance Steel &#038; Aluminum Co. (NYSE:RS) Shares Acquired by Mitsubishi UFJ Trust &#038; Banking Corp,Reliance Steel &#038; Aluminum Co. (NYSE:RS) Shares Acquired by Mitsubishi UFJ Trust &#038; Banking Corp,https://www.americanbankingnews.com/2022/01/28/reliance-steel-aluminum-co-nysers-shares-acquired-by-mitsubishi-ufj-trust-banking-corp.html,neutral,0.9161859154701232
2022-01-28T11:43:39+00:00,Maanshan Iron & Steel : ANNOUNCEMENT ON ESTIMATED GROWTH IN PROFIT IN ANNUAL RESULTS OF 2021,"(marketscreener.com) Hong Kong Exchanges and Clearing Limited and The Stock Exchange of Hong Kong Limited take no responsibility for the contents of this announcement, make no representation as to its accuracy or completeness and expressly disclaim any liability whatsoever for any loss howsoever arising from or in reliance upon the whole or...https://www.marketscreener.com/quote/stock/MAANSHAN-IRON-STEEL-COM-6165812/news/Maanshan-Iron-Steel-ANNOUNCEMENT-ON-ESTIMATED-GROWTH-IN-PROFIT-IN-ANNUAL-RESULTS-OF-2021-37670601/?utm_medium=RSS&utm_content=20220128",https://www.marketscreener.com/quote/stock/MAANSHAN-IRON-STEEL-COM-6165812/news/Maanshan-Iron-Steel-ANNOUNCEMENT-ON-ESTIMATED-GROWTH-IN-PROFIT-IN-ANNUAL-RESULTS-OF-2021-37670601/?utm_medium=RSS&utm_content=20220128,neutral,0.9009739756584167
2022-01-28T08:22:17+00:00,Adani Wilmar IPO - A Fortune Of Edible Oil: Reliance Securities,Adani Wilmar IPO - A Fortune Of Edible Oil: Reliance Securities,https://www.bloombergquint.com/research-reports/adani-wilmar-ipo-a-fortune-of-edible-oil-reliance-securities,neutral,0.9457279443740844
2022-01-28T06:46:12+00:00,Reliance Communications : Corporate Insolvency Resolution Process,(marketscreener.com) Reliance Communications Limited Tel : +91 022 3038 6286 Dhirubhai Ambani Knowledge City ...https://www.marketscreener.com/quote/stock/RELIANCE-COMMUNICATIONS-L-9059624/news/Reliance-Communications-Corporate-Insolvency-Resolution-Process-37667874/?utm_medium=RSS&utm_content=20220128,https://www.marketscreener.com/quote/stock/RELIANCE-COMMUNICATIONS-L-9059624/news/Reliance-Communications-Corporate-Insolvency-Resolution-Process-37667874/?utm_medium=RSS&utm_content=20220128,neutral,0.9323025345802308
2022-01-29T18:06:55+00:00,South Africa hails new COVID jab plant in fight for self-reliance,The project in Cape Town is the latest seeking to redress Africa’s reliance on the West for vaccines.,https://www.aljazeera.com/news/2022/1/29/south-africa-hails-new-covid-jab-plant-in-fight-for-self-reliance,positive,0.7184666395187378
